{
  "schemaVersion": "deepblend.recipe/v1",
  "id": "deepblend.metal-lamp",
  "version": "2.1.0",
  "title": "香槟金属桌灯",
  "description": "连续旋压灯罩、沿曲面延伸的金属细纹、珐琅内衬、曲线弯臂与贴地线缆。分别调整旋压件和拉丝件的粗糙度，同步调整金属颜色与摄影曝光；灯罩外径联动金属壁与内衬，颈口保持，提供独立内衬检查相机。",
  "author": {
    "name": "DeepBlend contributors",
    "url": "https://github.com/pearjelly/deep-blend"
  },
  "license": "MIT",
  "source": {
    "url": "https://github.com/pearjelly/deep-blend",
    "note": "Native metal-lamp benchmark with UV grain. SceneSpec bytes and native hero pixels are pinned; preview metadata is removed. Hero geometry/materials/camera remain unchanged; paired-profile diameter control and liner inspection camera are added. Source URL is attribution, not an installation endpoint."
  },
  "compatibility": {
    "sceneSchemaVersion": "deepblend.scene/v1",
    "capabilities": [
      "animation.transform",
      "geometry.curve",
      "geometry.lathe",
      "geometry.modifiers",
      "geometry.primitive",
      "material.anisotropy",
      "material.principled",
      "material.procedural",
      "material.procedural.uv",
      "recipe.geometry-bindings",
      "recipe.lathe-shell-bindings"
    ]
  },
  "input": {
    "path": "scene-spec.json",
    "sha256": "9170d39ad1d3b14e1e9332c10d0f0daf922c259407ea6ab545ef53e4b02f64f0"
  },
  "preview": {
    "path": "preview.png",
    "sha256": "a4c39a0679b5c829fa7183b55a5b637d3fcc0f6dfaf89e7dc0f2f319c9ed9572",
    "mediaType": "image/png",
    "alt": "香槟金属桌灯默认参数及曲面细纹的实际 Blender 渲染"
  },
  "parameters": [
    {
      "id": "shade-diameter-mm",
      "title": "灯罩外径（毫米）",
      "description": "调整实际灯罩外径，联动金属壁和内衬，保持颈口、弯臂、灯泡与关节；不整体缩放。",
      "type": "number",
      "default": 209.8,
      "minimum": 180,
      "maximum": 250,
      "bindings": [
        {
          "kind": "lathe-shell",
          "entityId": "shade-shell",
          "linerEntityId": "shade-enamel-lining",
          "outerPointCount": 45,
          "linerStart": 3,
          "linerPointCount": 37,
          "rimHeight": 0.008,
          "neckAnchorHeight": 0.118,
          "multiplier": 0.0005
        }
      ]
    },
    {
      "id": "main-color",
      "title": "主金属颜色",
      "description": "同步调整旋压件和拉丝件的金属色调。",
      "type": "color",
      "default": [
        0.63,
        0.535,
        0.415
      ],
      "bindings": [
        {
          "kind": "material",
          "materialId": "champagne-spun",
          "property": "baseColor"
        },
        {
          "kind": "material",
          "materialId": "champagne-brushed",
          "property": "baseColor"
        }
      ]
    },
    {
      "id": "spun-roughness",
      "title": "旋压件粗糙度",
      "description": "灯罩、底座和旋钮的光泽。数值越小，反光越集中。",
      "type": "number",
      "default": 0.28,
      "minimum": 0.22,
      "maximum": 0.6,
      "bindings": [
        {
          "kind": "material",
          "materialId": "champagne-spun",
          "property": "roughness"
        }
      ]
    },
    {
      "id": "brushed-roughness",
      "title": "拉丝件粗糙度",
      "description": "支架与弯臂的光泽。数值越小，反光越集中。",
      "type": "number",
      "default": 0.39,
      "minimum": 0.22,
      "maximum": 0.6,
      "bindings": [
        {
          "kind": "material",
          "materialId": "champagne-brushed",
          "property": "roughness"
        }
      ]
    },
    {
      "id": "exposure",
      "title": "摄影曝光",
      "description": "调整整体画面的明暗，预览和成品同步生效。",
      "type": "number",
      "default": 0,
      "minimum": -1,
      "maximum": 1,
      "bindings": [
        {
          "kind": "render-profile",
          "profile": "preview",
          "property": "exposure"
        },
        {
          "kind": "render-profile",
          "profile": "final",
          "property": "exposure"
        }
      ]
    }
  ]
}
