{
  "schemaVersion": "deepblend.recipe/v1",
  "id": "deepblend.glazed-cup",
  "version": "2.0.0",
  "title": "青釉带把手杯",
  "description": "105 mm 高的陶瓷杯，3 mm 壁厚，圆润杯沿与连续把手。根部曲面展开过渡；可调整釉色、光泽与曝光，创建后修改尺寸和连接曲面。",
  "author": {
    "name": "DeepBlend contributors",
    "url": "https://github.com/pearjelly/deep-blend"
  },
  "license": "MIT",
  "source": {
    "url": "https://github.com/pearjelly/deep-blend",
    "note": "Original procedural handled cup with explicit 1.5 endpoint tension, retained body dimensions and analytic corner normals. Actual fixed hero-camera Blender preview and SceneSpec bytes are pinned. Historical v1 is preserved separately; technical evidence is not artistic approval."
  },
  "compatibility": {
    "sceneSchemaVersion": "deepblend.scene/v1",
    "capabilities": [
      "geometry.handled_cup",
      "geometry.handled_cup.tension",
      "geometry.primitive",
      "material.principled"
    ]
  },
  "input": {
    "path": "scene-spec.json",
    "sha256": "7bf69996931787262aa7a1155d80149c8e2e2ee7041fd771884070c032ef80ca"
  },
  "preview": {
    "path": "preview.png",
    "sha256": "ce84a64b8bb3314c83b84f2f96c907fca7ee74cc24ad425c52df6cd915af197f",
    "mediaType": "image/png",
    "alt": "青釉带把手杯默认参数的实际 Blender 主视角渲染"
  },
  "parameters": [
    {
      "id": "main-color",
      "title": "陶瓷釉色",
      "description": "调整杯体与把手的统一釉色。",
      "type": "color",
      "default": [
        0.035,
        0.24,
        0.2
      ],
      "bindings": [
        {
          "kind": "material",
          "materialId": "glaze",
          "property": "baseColor"
        }
      ]
    },
    {
      "id": "surface-roughness",
      "title": "主表面粗糙度",
      "description": "调整陶瓷釉面的光泽；数值越小，表面越亮。",
      "type": "number",
      "default": 0.22,
      "minimum": 0.12,
      "maximum": 0.42,
      "bindings": [
        {
          "kind": "material",
          "materialId": "glaze",
          "property": "roughness"
        }
      ]
    },
    {
      "id": "exposure",
      "title": "摄影曝光",
      "description": "调整整体画面的明暗，预览和成品同步生效。",
      "type": "number",
      "default": 0,
      "minimum": -1,
      "maximum": 1,
      "bindings": [
        {
          "kind": "render-profile",
          "profile": "preview",
          "property": "exposure"
        },
        {
          "kind": "render-profile",
          "profile": "final",
          "property": "exposure"
        }
      ]
    }
  ]
}
